symbol,name,sector,industry
KERN,Akerna Corp. Common Stock,Health Care,Managed Health Care
KERNW,Akerna Corp Warrant,Health Care,Managed Health Care
KEX,Kirby Corporation Common Stock,Consumer Discretionary,Marine Transportation
KEY,KeyCorp Common Stock,Finance,Major Banks
KEY^I,KeyCorp Depositary Shares Each Representing a 1/40th Ownership Interest in a Share of Fixed-to-Floating Rate Perpetual Non-Cumulative Preferred Stock Series E,,
KEY^J,KeyCorp Depositary Shares each representing a 1/40th ownership interest in a share of Fixed Rate Perpetual Non-Cumulative Preferred Stock Series F,,
KEY^K,KeyCorp Depositary Shares each representing a 1/40th ownership interest in a share of Fixed Rate Perpetual Non-Cumulative Preferred Stock Series G,,
KEY^L,KeyCorp Depositary Shares each representing a 1/40th ownership interest in a share of Fixed Rate Perpetual Non-Cumulative Preferred Stock Series H,,
KEYS,Keysight Technologies Inc. Common Stock,Industrials,Industrial Machinery/Components
KF,Korea Fund Inc. (The) New Common Stock,Finance,Investment Managers
KFFB,Kentucky First Federal Bancorp Common Stock,Finance,Savings Institutions
KFRC,Kforce Inc. Common Stock,Consumer Discretionary,Diversified Commercial Services
KFS,Kingsway Financial Services Inc. Common Stock (DE),,
KFY,Korn Ferry Common Stock,Consumer Discretionary,Diversified Commercial Services
KGC,Kinross Gold Corporation Common Stock,,
KHC,The Kraft Heinz Company Common Stock,Consumer Staples,Farming/Seeds/Milling
KIDS,OrthoPediatrics Corp. Common Stock,Health Care,Medical/Dental Instruments
KIII,Kismet Acquisition Three Corp. Class A Ordinary Shares,Finance,Business Services
KIIIU,Kismet Acquisition Three Corp. Unit,Finance,Business Services
KIIIW,Kismet Acquisition Three Corp. Warrant,Finance,Business Services
KIM,Kimco Realty Corporation Common Stock,Real Estate,Real Estate Investment Trusts
KIM^L,Kimco Realty Corporation Class L Depositary Shares each of which represents a one-one thousandth fractional interest in a share of 5.125% Class L Cumulative Redeemable Preferred Stock liquidation preference $25000.00 per share,,
KIM^M,Kimco Realty Corporation Class M Depositary Shares each of which represents a one-one thousandth fractional interest in a share of 5.25% Class M Cumulative Redeemable Preferred Stock liquidation preference $25000.00 per share,,
KIND,Nextdoor Holdings Inc. Class A Common Stock,Consumer Discretionary,EDP Services
KINS,Kingstone Companies Inc. Common Stock,Finance,Specialty Insurers
KINZ,KINS Technology Group Inc. Class A Common Stock,Industrials,Consumer Electronics/Appliances
KINZU,KINS Technology Group Inc. Unit,Industrials,Consumer Electronics/Appliances
KINZW,KINS Technology Group Inc. Warrant,Industrials,Consumer Electronics/Appliances
KIO,KKR Income Opportunities Fund Common Shares,Finance,Investment Managers
KIQ,Kelso Technologies Inc Ordinary Shares,,
KIRK,Kirkland's Inc. COMMONSTOCK,Miscellaneous,Diversified Commercial Services
KITT,Nauticus Robotics Inc. Common stock,Industrials,Metal Fabrications
KITTW,Nauticus Robotics Inc. Warrant,Industrials,Metal Fabrications
KKR,KKR & Co. Inc. Common Stock,Finance,Investment Managers
KKR^C,KKR & Co. Inc. 6.00% Series C Mandatory Convertible Preferred Stock,,
KKRS,KKR Group Finance Co. IX LLC 4.625% Subordinated Notes due 2061,,
KLAC,KLA Corporation Common Stock,Technology,Electronic Components
KLAQ,KL Acquisition Corp Class A Common Stock,Industrials,Consumer Electronics/Appliances
KLIC,Kulicke and Soffa Industries Inc. Common Stock,Technology,Semiconductors
KLR,Kaleyra Inc. Common Stock,Technology,Retail: Computer Software & Peripheral Equipment
KLTR,Kaltura Inc. Common Stock,Technology,EDP Services
KLXE,KLX Energy Services Holdings Inc. Common Stock,Energy,Oilfield Services/Equipment
KMB,Kimberly-Clark Corporation Common Stock,Consumer Discretionary,Paper
KMDA,Kamada Ltd. Ordinary Shares,Health Care,Biotechnology: Pharmaceutical Preparations
KMF,Kayne Anderson NextGen Energy & Infrastructure Inc.,Finance,Investment Managers
KMI,Kinder Morgan Inc. Common Stock,Utilities,Natural Gas Distribution
KMPB,Kemper Corporation 5.875% Fixed-Rate Reset Junior Subordinated Debentures due 2062,,
KMPH,KemPharm Inc. Common Stock,Health Care,Biotechnology: Pharmaceutical Preparations
KMPR,Kemper Corporation,Finance,Property-Casualty Insurers
KMT,Kennametal Inc. Common Stock,Industrials,Industrial Machinery/Components
KMX,CarMax Inc,Consumer Discretionary,Other Specialty Stores
KN,Knowles Corporation Common Stock,Telecommunications,Telecommunications Equipment
KNBE,KnowBe4 Inc. Class A Common Stock,Technology,Computer Software: Prepackaged Software
KNDI,Kandi Technologies Group Inc Common Stock,Consumer Discretionary,Auto Parts:O.E.M.
KNOP,KNOT Offshore Partners LP Common Units representing Limited Partner Interests,Consumer Discretionary,Marine Transportation
KNSA,Kiniksa Pharmaceuticals Ltd. Class A Common Stock,Health Care,Biotechnology: Pharmaceutical Preparations
KNSL,Kinsale Capital Group Inc. Common Stock,Finance,Property-Casualty Insurers
KNSW,KnightSwan Acquisition Corporation Class A Common Stock,Industrials,Consumer Electronics/Appliances
KNTE,Kinnate Biopharma Inc. Common Stock,Health Care,Biotechnology: Pharmaceutical Preparations
KNTK,Kinetik Holdings Inc. Class A Common Stock,Energy,Oil & Gas Production
KNW,Know Labs Inc. Common Stock,Industrials,Industrial Machinery/Components
KNX,Knight-Swift Transportation Holdings Inc.,Industrials,Trucking Freight/Courier Services
KO,Coca-Cola Company (The) Common Stock,Consumer Staples,Beverages (Production/Distribution)
KOD,Kodiak Sciences Inc Common Stock,Health Care,Biotechnology: Pharmaceutical Preparations
KODK,Eastman Kodak Company Common New,Consumer Discretionary,Business Services
KOF,Coca Cola Femsa S.A.B. de C.V.  American Depositary Shares each representing 10 Units (each Unit consists of 3 Series B Shares and 5 Series L Shares),Consumer Staples,Beverages (Production/Distribution)
KOP,Koppers Holdings Inc. Koppers Holdings Inc. Common Stock,Industrials,Industrial Specialties
KOPN,Kopin Corporation Common Stock,Technology,Industrial Machinery/Components
KORE,KORE Group Holdings Inc. Common Stock,Consumer Discretionary,Telecommunications Equipment
KOS,Kosmos Energy Ltd. Common Shares (DE),Energy,Oil & Gas Production
KOSS,Koss Corporation Common Stock,Consumer Staples,Consumer Electronics/Appliances
KPLT,Katapult Holdings Inc. Common Stock,Technology,EDP Services
KPLTW,Katapult Holdings Inc. Warrant,Technology,EDP Services
KPRX,Kiora Pharmaceuticals Inc.  Common Stock,Health Care,Biotechnology: In Vitro & In Vivo Diagnostic Substances
KPTI,Karyopharm Therapeutics Inc. Common Stock,Miscellaneous,Diversified Commercial Services
KR,Kroger Company (The) Common Stock,Consumer Staples,Food Chains
KRBP,Kiromic BioPharma Inc. Common Stock,Health Care,Medicinal Chemicals and Botanical Products
KRC,Kilroy Realty Corporation Common Stock,Real Estate,Real Estate Investment Trusts
KREF,KKR Real Estate Finance Trust Inc. Common Stock,Real Estate,Real Estate Investment Trusts
KREF^A,KKR Real Estate Finance Trust Inc. 6.50% Series A Cumulative Redeemable Preferred Stock,,
KRG,Kite Realty Group Trust Common Stock,Real Estate,Real Estate Investment Trusts
KRKR,36Kr Holdings Inc. American Depositary Shares,Consumer Discretionary,Business Services
KRMD,KORU Medical Systems Inc. Common Stock,Health Care,Medical/Dental Instruments
KRNL,Kernel Group Holdings Inc. Class A Ordinary Shares,Finance,Business Services
KRNLW,Kernel Group Holdings Inc. Warrants,Finance,Business Services
KRNT,Kornit Digital Ltd. Ordinary Shares,Industrials,Industrial Machinery/Components
KRNY,Kearny Financial Corp Common Stock,Finance,Savings Institutions
KRO,Kronos Worldwide Inc Common Stock,Industrials,Major Chemicals
KRON,Kronos Bio Inc. Common Stock,Health Care,Medicinal Chemicals and Botanical Products
KROS,Keros Therapeutics Inc. Common Stock,Health Care,Medicinal Chemicals and Botanical Products
KRP,Kimbell Royalty Partners Common Units Representing Limited Partner Interests,Energy,Oil & Gas Production
KRT,Karat Packaging Inc. Common Stock,Industrials,Office Equipment/Supplies/Services
KRTX,Karuna Therapeutics Inc. Common Stock,Health Care,Biotechnology: Pharmaceutical Preparations
KRUS,Kura Sushi USA Inc. Class A Common Stock,Consumer Discretionary,Restaurants
KRYS,Krystal Biotech Inc. Common Stock,Health Care,Biotechnology: Biological Products (No Diagnostic Substances)
KSCP,Knightscope Inc. Class A Common Stock,Technology,Security Systems Services
KSI,Kadem Sustainable Impact Corporation Class A common stock,Industrials,Consumer Electronics/Appliances
KSICU,Kadem Sustainable Impact Corporation Unit,Industrials,Consumer Electronics/Appliances
KSICW,Kadem Sustainable Impact Corporation Warrant,Industrials,Consumer Electronics/Appliances
KSM,DWS Strategic Municipal Income Trust,Finance,Trusts Except Educational Religious and Charitable
KSPN,Kaspien Holdings Inc. Common Stock,Technology,Retail: Computer Software & Peripheral Equipment
KSS,Kohl's Corporation Common Stock,Consumer Discretionary,Department/Specialty Retail Stores
KT,KT Corporation Common Stock,Telecommunications,Telecommunications Equipment
KTB,Kontoor Brands Inc. Common Stock,,
KTCC,Key Tronic Corporation Common Stock,Technology,Computer peripheral equipment
KTF,DWS Municipal Income Trust,Finance,Finance Companies
KTH,Structures Products Cp 8% CorTS Issued by Peco Energy Cap Tr II Preferred Stock,Finance,Investment Managers
KTN,Structured Products Corp 8.205% CorTS 8.205% Corporate Backed Trust Securities (CorTS),,
KTOS,Kratos Defense & Security Solutions Inc. Common Stock,Consumer Discretionary,Ordnance And Accessories
KTRA,Kintara Therapeutics Inc. Common Stock,Health Care,Biotechnology: Pharmaceutical Preparations
KTTA,Pasithea Therapeutics Corp. Common Stock,Health Care,Biotechnology: Pharmaceutical Preparations
KTTAW,Pasithea Therapeutics Corp. Warrant,Health Care,Biotechnology: Pharmaceutical Preparations
KUKE,Kuke Music Holding Limited American Depositary Shares each representing one Ordinary Share,Real Estate,Other Consumer Services
KULR,KULR Technology Group Inc. Common Stock,,
KURA,Kura Oncology Inc. Common Stock,Health Care,Biotechnology: Biological Products (No Diagnostic Substances)
KVHI,KVH Industries Inc. Common Stock,Technology,Radio And Television Broadcasting And Communications Equipment
KVSA,Khosla Ventures Acquisition Co. Class A Common Stock,Industrials,Consumer Electronics/Appliances
KVSC,Khosla Ventures Acquisition Co. III Class A Common Stock,Industrials,Consumer Electronics/Appliances
KW,Kennedy-Wilson Holdings Inc. Common Stock,Real Estate,Real Estate
KWR,Quaker Houghton Common Stock,Industrials,Automotive Aftermarket
KXIN,Kaixin Auto Holdings Ordinary Shares,Finance,Business Services
KYCH,Keyarch Acquisition Corporation Ordinary Shares,,
KYCHR,Keyarch Acquisition Corporation Rights,,
KYCHU,Keyarch Acquisition Corporation Unit,,
KYCHW,Keyarch Acquisition Corporation Warrant,,
KYMR,Kymera Therapeutics Inc. Common Stock,Health Care,Medicinal Chemicals and Botanical Products
KYN,Kayne Anderson Energy Infrastructure Fund Inc.,Finance,Finance/Investors Services
KZIA,Kazia Therapeutics Limited American Depositary Shares,Health Care,Biotechnology: Pharmaceutical Preparations
KZR,Kezar Life Sciences Inc. Common Stock,Health Care,Biotechnology: Pharmaceutical Preparations
L,Loews Corporation Common Stock,Finance,Property-Casualty Insurers
LAAAW,Lakeshore Acquisition I Corp. Warrant,,
LAB,Standard BioTools Inc. Common Stock,Industrials,Biotechnology: Laboratory Analytical Instruments
LABP,Landos Biopharma Inc. Common Stock,Health Care,Medicinal Chemicals and Botanical Products
LAC,Lithium Americas Corp. Common Shares,,
LAD,Lithia Motors Inc. Common Stock,Consumer Discretionary,Other Specialty Stores
LADR,Ladder Capital Corp Class A Common Stock,Real Estate,Real Estate Investment Trusts
LAKE,Lakeland Industries Inc. Common Stock,,
LAMR,Lamar Advertising Company Class A Common Stock,Real Estate,Real Estate Investment Trusts
LANC,Lancaster Colony Corporation Common Stock,Consumer Staples,Packaged Foods
LAND,Gladstone Land Corporation Common Stock,Real Estate,Real Estate Investment Trusts
LANDM,Gladstone Land Corporation 5.00% Series D Cumulative Term Preferred Stock,Real Estate,Real Estate Investment Trusts
LANDO,Gladstone Land Corporation 6.00% Series B Cumulative Redeemable Preferred Stock,Real Estate,Real Estate Investment Trusts
LARK,Landmark Bancorp Inc. Common Stock,Finance,Major Banks
LASR,nLIGHT Inc. Common Stock,Technology,Semiconductors
LATG,LatAmGrowth SPAC Class A Ordinary Shares,,
LATGU,LatAmGrowth SPAC Unit,,
LAUR,Laureate Education Inc. Common Stock,Consumer Discretionary,Service to the Health Industry
LAW,CS Disco Inc. Common Stock,Technology,Computer Software: Prepackaged Software
LAX,8i Acquisition 2 Corp. Ordinary Shares,,
LAXXR,8i Acquisition 2 Corp. Rights,,
LAXXU,8i Acquisition 2 Corp. Unit,,
LAXXW,8i Acquisition 2 Corp. Warrant,,
LAZ,Lazard LTD. Lazard LTD. Class A Common Stock,Finance,Investment Managers
LAZR,Luminar Technologies Inc.  Class A Common Stock,Consumer Discretionary,Auto Parts:O.E.M.
LAZY,Lazydays Holdings Inc. Common Stock,Consumer Discretionary,Other Specialty Stores
LBAI,Lakeland Bancorp Inc. Common Stock,Finance,Major Banks
LBBBU,Lakeshore Acquisition II Corp. Unit,,
LBBBW,Lakeshore Acquisition II Corp. Warrants,,
LBC,Luther Burbank Corporation Common Stock,Finance,Commercial Banks
LBPH,Longboard Pharmaceuticals Inc. Common Stock,Health Care,Biotechnology: Pharmaceutical Preparations
LBRDA,Liberty Broadband Corporation Class A Common Stock,Consumer Discretionary,Telecommunications Equipment
LBRDK,Liberty Broadband Corporation Class C Common Stock,Consumer Discretionary,Telecommunications Equipment
LBRDP,Liberty Broadband Corporation Series A Cumulative Redeemable Preferred Stock,Consumer Discretionary,Telecommunications Equipment
LBRT,Liberty Energy Inc. Class A common stock,Energy,Oilfield Services/Equipment
LBTYA,Liberty Global plc Class A Ordinary Shares,Telecommunications,Cable & Other Pay Television Services
LBTYB,Liberty Global plc Class B Ordinary Shares,Telecommunications,Cable & Other Pay Television Services
LBTYK,Liberty Global plc Class C Ordinary Shares,Telecommunications,Cable & Other Pay Television Services
LC,LendingClub Corporation Common Stock,Finance,Finance Companies
LCA,Landcadia Holdings IV Inc. Class A Common Stock,Industrials,Consumer Electronics/Appliances
LCAA,L Catterton Asia Acquisition Corp Class A Ordinary Shares,Finance,Business Services
LCAHU,Landcadia Holdings IV Inc. Units,Industrials,Consumer Electronics/Appliances
LCAHW,Landcadia Holdings IV Inc. Warrant,Industrials,Consumer Electronics/Appliances
LCFY,Locafy Limited Ordinary Share,,
LCI,Lannett Co Inc Common Stock,Health Care,Biotechnology: Pharmaceutical Preparations
LCID,Lucid Group Inc. Common Stock,Consumer Discretionary,Auto Manufacturing
LCII,LCI Industries,Consumer Discretionary,Auto Parts:O.E.M.
LCNB,LCNB Corporation Common Stock,Finance,Major Banks
LCTX,Lineage Cell Therapeutics Inc. Common Stock,Health Care,Biotechnology: Biological Products (No Diagnostic Substances)
LCUT,Lifetime Brands Inc. Common Stock,Consumer Discretionary,Home Furnishings
LDHA,LDH Growth Corp I Class A Ordinary Shares,Finance,Business Services
LDI,loanDepot Inc. Class A Common Stock,Finance,Finance: Consumer Services
LDOS,Leidos Holdings Inc. Common Stock,Technology,EDP Services
LDP,Cohen & Steers Limited Duration Preferred and Income Fund Inc.,Finance,Finance Companies
LE,Lands' End Inc. Common Stock,Consumer Discretionary,Clothing/Shoe/Accessory Stores
LEA,Lear Corporation Common Stock,Consumer Discretionary,Auto Parts:O.E.M.
LECO,Lincoln Electric Holdings Inc. Common Shares,Industrials,Industrial Machinery/Components
LEDS,SemiLEDS Corporation Common Stock,Technology,Semiconductors
LEE,Lee Enterprises Incorporated Common Stock,Consumer Discretionary,Newspapers/Magazines
LEG,Leggett & Platt Incorporated Common Stock,Consumer Discretionary,Home Furnishings
LEGA,Lead Edge Growth Opportunities Ltd Class A Ordinary Shares,Finance,Business Services
LEGAU,Lead Edge Growth Opportunities Ltd Units,Finance,Business Services
LEGAW,Lead Edge Growth Opportunities Ltd Warrant,Finance,Business Services
LEGH,Legacy Housing Corporation Common Stock (TX),Consumer Discretionary,Homebuilding
LEGN,Legend Biotech Corporation American Depositary Shares,Health Care,Biotechnology: Pharmaceutical Preparations
LEJU,Leju Holdings Limited American Depositary Shares each representing one Ordinary share,Finance,Real Estate
LEN,Lennar Corporation Class A Common Stock,Real Estate,Building operators
LEO,BNY Mellon Strategic Municipals Inc. Common Stock,Finance,Trusts Except Educational Religious and Charitable
LESL,Leslie's Inc. Common Stock,Consumer Discretionary,
LEU,Centrus Energy Corp. Class A Common Stock,,
LEV,The Lion Electric Company Common Shares,,
LEVI,Levi Strauss & Co Class A Common Stock,Consumer Discretionary,Industrial Specialties
LEXX,Lexaria Bioscience Corp. Common Stock,Health Care,Biotechnology: Pharmaceutical Preparations
LEXXW,Lexaria Bioscience Corp. Warrant,Health Care,Biotechnology: Pharmaceutical Preparations
LFAC,LF Capital Acquisition Corp. II Class A Common Stock,Industrials,Consumer Electronics/Appliances
LFACU,LF Capital Acquisition Corp. II Units,Industrials,Consumer Electronics/Appliances
LFACW,LF Capital Acquisition Corp. II Warrants,Industrials,Consumer Electronics/Appliances
LFG,Archaea Energy Inc. Class A Common Stock,Utilities,Power Generation
LFLY,Leafly Holdings Inc. Common Stock,Consumer Staples,Retail-Drug Stores and Proprietary Stores
LFLYW,Leafly Holdings Inc. Warrant,Consumer Staples,Retail-Drug Stores and Proprietary Stores
LFMD,LifeMD Inc. Common Stock,Miscellaneous,Diversified Commercial Services
LFMDP,LifeMD Inc. 8.875% Series A Cumulative Perpetual Preferred Stock,Miscellaneous,Diversified Commercial Services
LFST,LifeStance Health Group Inc. Common Stock,Health Care,Hospital/Nursing Management
LFT,Lument Finance Trust Inc. Common Stock,Real Estate,Real Estate Investment Trusts
LFT^A,Lument Finance Trust Inc. 7.875% Series A Cumulative Redeemable Preferred Stock,,
LFTR,Lefteris Acquisition Corp. Class A Common Stock,Industrials,Consumer Electronics/Appliances
LFTRU,Lefteris Acquisition Corp. Unit,Industrials,Consumer Electronics/Appliances
LFTRW,Lefteris Acquisition Corp. Warrant,Industrials,Consumer Electronics/Appliances
LFUS,Littelfuse Inc. Common Stock,Technology,Electronic Components
LFVN,Lifevantage Corporation Common Stock (Delaware),Consumer Staples,Farming/Seeds/Milling
LGAC,Lazard Growth Acquisition Corp. I Ordinary Shares,Finance,Business Services
LGACU,Lazard Growth Acquisition Corp. I Units,Finance,Business Services
LGACW,Lazard Growth Acquisition Corp. I Warrants,Finance,Business Services
LGHL,Lion Group Holding Ltd. American Depositary Share,Finance,Investment Bankers/Brokers/Service
LGHLW,Lion Group Holding Ltd. Warrant,Finance,Investment Bankers/Brokers/Service
LGI,Lazard Global Total Return and Income Fund Common Stock,,
LGIH,LGI Homes Inc. Common Stock,Consumer Discretionary,Homebuilding
LGL,LGL Group Inc. (The) Common Stock,Technology,Industrial Machinery/Components
LGMK,LogicMark Inc. Common Stock,Consumer Discretionary,Diversified Commercial Services
LGND,Ligand Pharmaceuticals Incorporated Common Stock,Health Care,Biotechnology: Pharmaceutical Preparations
LGO,Largo Inc. Common Shares,,
LGST,Semper Paratus Acquisition Corporation Class A Ordinary Shares,,
LGSTU,Semper Paratus Acquisition Corporation Unit,,
LGSTW,Semper Paratus Acquisition Corporation Warrant,,
LGTO,Legato Merger Corp. II Common Stock,Industrials,Consumer Electronics/Appliances
LGTOU,Legato Merger Corp. II Unit,Industrials,Consumer Electronics/Appliances
LGTOW,Legato Merger Corp. II Warrants,Industrials,Consumer Electronics/Appliances
LGV,Longview Acquisition Corp. II Class A Common Stock,Industrials,Consumer Electronics/Appliances
LGVC,LAMF Global Ventures Corp. I Class A Ordinary Shares,,
LGVCU,LAMF Global Ventures Corp. I Unit,,
LGVCW,LAMF Global Ventures Corp. I Warrant,,
LGVN,Longeveron Inc. Class A Common Stock,Health Care,Medicinal Chemicals and Botanical Products
LH,Laboratory Corporation of America Holdings Common Stock,Health Care,Medical Specialities
LHAA,Lerer Hippeau Acquisition Corp. Class A Common Stock,Industrials,Consumer Electronics/Appliances
LHC,Leo Holdings Corp. II Class A Ordinary Shares,Finance,Business Services
LHCG,LHC Group Common Stock,Health Care,Medical/Nursing Services
LHDX,Lucira Health Inc. Common Stock,Health Care,Biotechnology: Electromedical & Electrotherapeutic Apparatus
LHX,L3Harris Technologies Inc. Common Stock,Industrials,Industrial Machinery/Components
LI,Li Auto Inc. American Depositary Shares,Consumer Discretionary,Auto Manufacturing
LIAN,LianBio American Depositary Shares,,
LIBY,Liberty Resources Acquisition Corp. Class A Common Stock,Industrials,Consumer Electronics/Appliances
LIBYU,Liberty Resources Acquisition Corp. Unit,Industrials,Consumer Electronics/Appliances
LIBYW,Liberty Resources Acquisition Corp. Warrant,Industrials,Consumer Electronics/Appliances
LICY,Li-Cycle Holdings Corp. Common Shares,,
LIDR,AEye Inc. Class A Common Stock,Consumer Discretionary,Auto Parts:O.E.M.
LIDRW,AEye Inc. Warrant,Consumer Discretionary,Auto Parts:O.E.M.
LIFE,aTyr Pharma Inc. Common Stock,Health Care,Biotechnology: Biological Products (No Diagnostic Substances)
LII,Lennox International Inc. Common Stock,Industrials,Industrial Machinery/Components
LILA,Liberty Latin America Ltd. Class A Common Stock,Telecommunications,Cable & Other Pay Television Services
LILAK,Liberty Latin America Ltd. Class C Common Stock,Telecommunications,Cable & Other Pay Television Services
LILM,Lilium N.V. Class A Ordinary Shares,,
LILMW,Lilium N.V. Warrants,,
LIN,Linde plc Ordinary Share,Industrials,Major Chemicals
LINC,Lincoln Educational Services Corporation Common Stock,Consumer Discretionary,Service to the Health Industry
LIND,Lindblad Expeditions Holdings Inc. Common Stock,,
LINK,Interlink Electronics Inc. Common Stock,Technology,Industrial Machinery/Components
LION,Lionheart III Corp Class A Common Stock,Industrials,Consumer Electronics/Appliances
LIONU,Lionheart III Corp Unit,Industrials,Consumer Electronics/Appliances
LIONW,Lionheart III Corp Warrant,Industrials,Consumer Electronics/Appliances
LIQT,LiqTech International Inc. Common Stock,Industrials,Industrial Machinery/Components
LITB,LightInTheBox Holding Co. Ltd. American Depositary Shares each representing 2 ordinary shares,Consumer Discretionary,Catalog/Specialty Distribution
LITE,Lumentum Holdings Inc. Common Stock,Technology,Computer peripheral equipment
LITM,Snow Lake Resources Ltd. Common Shares,,
LITT,Logistics Innovation Technologies Corp. Class A Common Stock,Industrials,Consumer Electronics/Appliances
LITTW,Logistics Innovation Technologies Corp. Warrant,Industrials,Consumer Electronics/Appliances
LIVB,LIV Capital Acquisition Corp. II Class A Ordinary Shares,,
LIVBU,LIV Capital Acquisition Corp. II Unit,,
LIVBW,LIV Capital Acquisition Corp. II Warrants,,
LIVE,Live Ventures Incorporated Common Stock,,
LIVN,LivaNova PLC Ordinary Shares,Health Care,Biotechnology: Electromedical & Electrotherapeutic Apparatus
LIXT,Lixte Biotechnology Holdings Inc. Common Stock,Health Care,Biotechnology: Pharmaceutical Preparations
LIXTW,Lixte Biotechnology Holdings Inc. Warrants,Health Care,Biotechnology: Pharmaceutical Preparations
LIZI,LIZHI INC. American Depositary Shares,Technology,Computer Software: Programming Data Processing
LJAQW,LightJump Acquisition Corporation Warrant,Industrials,Consumer Electronics/Appliances
LKCO,Luokung Technology Corp Ordinary Shares,Technology,EDP Services
LKFN,Lakeland Financial Corporation Common Stock,Finance,Major Banks
LKQ,LKQ Corporation Common Stock,Consumer Discretionary,Automotive Aftermarket
LL,LL Flooring Holdings Inc. Common Stock,Consumer Discretionary,RETAIL: Building Materials
LLAP,Terran Orbital Corporation Common Stock,,
LLL,JX Luxventure Limited Common Stock,Consumer Staples,Apparel
LLY,Eli Lilly and Company Common Stock,Health Care,Biotechnology: Pharmaceutical Preparations
LMACA,Liberty Media Acquisition Corporation Series A Common Stock,Industrials,Consumer Electronics/Appliances
LMACU,Liberty Media Acquisition Corporation Unit,Industrials,Consumer Electronics/Appliances
LMACW,Liberty Media Acquisition Corporation Warrants,Industrials,Consumer Electronics/Appliances
LMAO,LMF Acquisition Opportunities Inc. Class A common stock,Health Care,Medical/Dental Instruments
LMAOW,LMF Acquisition Opportunities Inc. Warrant,Industrials,Consumer Electronics/Appliances
LMAT,LeMaitre Vascular Inc. Common Stock,Health Care,Medical/Dental Instruments
LMB,Limbach Holdings Inc. Common Stock,Consumer Discretionary,Military/Government/Technical
LMDX,LumiraDx Limited Common Shares,Health Care,Biotechnology: In Vitro & In Vivo Diagnostic Substances
LMDXW,LumiraDx Limited Warrant,Health Care,Biotechnology: In Vitro & In Vivo Diagnostic Substances
LMFA,LM Funding America Inc. Common Stock,Finance,Finance: Consumer Services
LMND,Lemonade Inc. Common Stock,Finance,Property-Casualty Insurers
LMNL,Liminal BioSciences Inc. Common Shares,Health Care,Medicinal Chemicals and Botanical Products
LMNR,Limoneira Co Common Stock,Consumer Staples,Farming/Seeds/Milling
LMST,Limestone Bancorp Inc. Common Stock,Finance,Major Banks
LMT,Lockheed Martin Corporation Common Stock,Industrials,Aerospace
LNC,Lincoln National Corporation Common Stock,Finance,Life Insurance
LND,Brasilagro Brazilian Agric Real Estate Co Sponsored ADR (Brazil),Consumer Staples,Farming/Seeds/Milling
LNDC,Landec Corporation Common Stock (DE),Health Care,Biotechnology: Pharmaceutical Preparations
LNG,Cheniere Energy Inc. Common Stock,Utilities,Oil/Gas Transmission
LNKB,LINKBANCORP Inc. Common Stock,,
