symbol,name,sector,industry
PRIM,Primoris Services Corporation Common Stock,Industrials,Water Sewer Pipeline Comm & Power Line Construction
PRK,Park National Corporation Common Stock,Finance,Major Banks
PRLB,Proto Labs Inc. Common stock,Industrials,Office Equipment/Supplies/Services
PRLD,Prelude Therapeutics Incorporated Common Stock,Health Care,Medicinal Chemicals and Botanical Products
PRLH,Pearl Holdings Acquisition Corp Class A Ordinary Shares,,
PRLHU,Pearl Holdings Acquisition Corp Unit,,
PRM,Perimeter Solutions SA Ordinary Shares,,
PRMW,Primo Water Corporation Common Stock,Consumer Staples,Farming/Seeds/Milling
PRO,PROS Holdings Inc. Common Stock,Technology,EDP Services
PROC,Procaps Group S.A. Ordinary Shares,,
PROCW,Procaps Group S.A. Warrants,,
PROF,Profound Medical Corp. Common Stock,,
PROK,ProKidney Corp. Class A Ordinary Shares,,
PROV,Provident Financial Holdings Inc. Common Stock,Finance,Savings Institutions
PRPC,CC Neuberger Principal Holdings III Class A Ordinary Shares,Finance,Business Services
PRPH,ProPhase Labs Inc. Common Stock (DE),Health Care,Biotechnology: Pharmaceutical Preparations
PRPL,Purple Innovation Inc. Common Stock,Consumer Discretionary,Home Furnishings
PRPO,Precipio Inc.  Common Stock,Industrials,Biotechnology: Laboratory Analytical Instruments
PRQR,ProQR Therapeutics N.V. Ordinary Shares,Health Care,Biotechnology: Pharmaceutical Preparations
PRS,Prudential Financial Inc. 5.625% Junior Subordinated Notes due 2058,Finance,Life Insurance
PRSO,Peraso Inc. Common Stock,Technology,Semiconductors
PRSR,Prospector Capital Corp. Class A Ordinary Shares,Finance,Business Services
PRSRU,Prospector Capital Corp. Unit,Finance,Business Services
PRSRW,Prospector Capital Corp. Warrants,Finance,Business Services
PRST,Presto Automation Inc. Common Stock,Technology,Computer Software: Prepackaged Software
PRSTW,Presto Automation Inc. Warrant,Industrials,Consumer Electronics/Appliances
PRT,PermRock Royalty Trust Trust Units,Energy,Oil & Gas Production
PRTA,Prothena Corporation plc Ordinary Shares,Health Care,Biotechnology: Pharmaceutical Preparations
PRTC,PureTech Health plc American Depositary Shares,Finance,Investment Managers
PRTG,Portage Biotech Inc. Common Stock,Health Care,Biotechnology: Biological Products (No Diagnostic Substances)
PRTH,Priority Technology Holdings Inc. Common Stock,Technology,EDP Services
PRTK,Paratek Pharmaceuticals Inc. Common Stock,Health Care,Biotechnology: Pharmaceutical Preparations
PRTS,CarParts.com Inc. Common Stock,Consumer Discretionary,Auto & Home Supply Stores
PRTY,Party City Holdco Inc. Common Stock,Miscellaneous,Diversified Commercial Services
PRU,Prudential Financial Inc. Common Stock,Finance,Life Insurance
PRVA,Privia Health Group Inc. Common Stock,Technology,Retail: Computer Software & Peripheral Equipment
PRVB,Provention Bio Inc. Common Stock,Health Care,Biotechnology: Pharmaceutical Preparations
PSA,Public Storage Common Stock,Real Estate,Real Estate Investment Trusts
PSA^F,Public Storage Depositary Shares Each Representing 1/1000 of a 5.15% Cumulative Preferred Share of Beneficial Interest Series F par value $0.01 per share,,
PSA^G,Public Storage Depositary Shares Each Representing 1/1000 of a 5.05% Cumulative Preferred Share of Beneficial Interest Series G,,
PSA^H,Public Storage Depositary Shares Each Representing 1/1000 of a  5.60% Cumulative Preferred  Share of Beneficial Interest Series H,,
PSA^I,Public Storage Depositary Shares Each Representing 1/1000 of a 4.875% Cumulative Preferred Share of Beneficial Interest Series I par value $0.01 per share,,
PSA^J,Public Storage Depositary Shares Each Representing 1/1000 of a 4.700% Cumulative Preferred Share of Beneficial Interest Series J par value $0.01 per share,,
PSA^K,Public Storage Depositary Shares Each Representing 1/1000 of a 4.75% Cumulative Preferred Share of Beneficial Interest Series K,,
PSA^L,Public Storage Depositary Shares Each Representing 1/1000 of a 4.625% Cumulative Preferred Share of Beneficial Interest Series L par value $0.01 per share,,
PSA^M,Public Storage Depositary Shares Each Representing 1/1000 of a 4.125% Cumulative Preferred Share of Beneficial Interest Series M,,
PSA^N,Public Storage Depositary Shares Each Representing 1/1000 of a 3.875% Cumulative Preferred Share of Beneficial Interest Series N,,
PSA^O,Public Storage Depositary Shares Each Representing 1/1000 of a 3.900% Cumulative Preferred Share of Beneficial Interest Series O,,
PSA^P,Public Storage Depositary Shares Each Representing 1/1000 of a 4.000% Cumulative Preferred Share of Bene cial Interest Series P,,
PSA^Q,Public Storage Depositary Shares Each Representing 1/1000 of a 3.950% Cumulative Preferred Share of Beneficial Interest Series Q par value $0.01 per share,,
PSA^R,Public Storage Depositary Shares Each Representing 1/1000 of a 4.00% Cumulative Preferred Share of Bene cial Interest Series R,,
PSA^S,Public Storage Depositary Shares Each Representing 1/1000 of a 4.100% Cumulative Preferred Share of Beneficial Interest Series S,,
PSAG,Property Solutions Acquisition Corporation II Class A Common Stock,Industrials,Consumer Electronics/Appliances
PSAGU,Property Solutions Acquisition Corporation II Units,Industrials,Consumer Electronics/Appliances
PSAGW,Property Solutions Acquisition Corporation II Warrant,Industrials,Consumer Electronics/Appliances
PSB^X,PS Business Parks Inc. Depositary Shares Each Representing 1/1000 of a Share of 5.25% Cumulative Preferred Stock Series X,,
PSB^Y,PS Business Parks Inc. 5.20% Cumulative Preferred Stock Series Y,,
PSB^Z,PS Business Parks Inc. Depositary Shares Each Representing 1/1000 of a Share of 4.875% Cumulative Preferred Stock Series Z  par value $0.01 per share,,
PSEC,Prospect Capital Corporation Common Stock,Finance,Finance/Investors Services
PSEC^A,Prospect Capital Corporation 5.35% Series A Fixed Rate Cumulative Perpetual Preferred Stock,,
PSF,Cohen & Steers Select Preferred and Income Fund Inc. Common Stock,Finance,Investment Managers
PSFE,Paysafe Limited Common Shares,Consumer Discretionary,Business Services
PSHG,Performance Shipping Inc. Common Shares,Consumer Discretionary,Marine Transportation
PSMT,PriceSmart Inc. Common Stock,Consumer Discretionary,Department/Specialty Retail Stores
PSN,Parsons Corporation Common Stock,Industrials,Industrial Machinery/Components
PSNL,Personalis Inc. Common Stock,Health Care,Biotechnology: In Vitro & In Vivo Diagnostic Substances
PSNY,Polestar Automotive Holding UK PLC Class A ADS,,
PSNYW,Polestar Automotive Holding UK PLC Class C-1 ADS (ADW),Industrials,Consumer Electronics/Appliances
PSO,Pearson Plc Common Stock,Consumer Discretionary,Books
PSPC,Post Holdings Partnering Corporation Series A Common Stock,Industrials,Consumer Electronics/Appliances
PSTG,Pure Storage Inc. Class A Common Stock,Technology,Electronic Components
PSTL,Postal Realty Trust Inc. Class A Common Stock,Real Estate,Real Estate Investment Trusts
PSTV,PLUS THERAPEUTICS Inc. Common Stock,Health Care,Medical/Dental Instruments
PSTX,Poseida Therapeutics Inc. Common Stock,Health Care,Medicinal Chemicals and Botanical Products
PSX,Phillips 66 Common Stock,Energy,Integrated oil Companies
PT,Pintec Technology Holdings Limited American Depositary Shares,Technology,Computer Software: Programming Data Processing
PTA,Cohen & Steers Tax-Advantaged Preferred Securities and Income Fund Common Shares of Beneficial Interest,Finance,Trusts Except Educational Religious and Charitable
PTC,PTC Inc. Common Stock,Technology,Computer Software: Prepackaged Software
PTCT,PTC Therapeutics Inc. Common Stock,Health Care,Biotechnology: Pharmaceutical Preparations
PTE,PolarityTE Inc. Common Stock,Health Care,Medicinal Chemicals and Botanical Products
PTEN,Patterson-UTI Energy Inc. Common Stock,Energy,Oil & Gas Production
PTGX,Protagonist Therapeutics Inc. Common Stock,Health Care,Biotechnology: Pharmaceutical Preparations
PTIC,PropTech Investment Corporation II Class A Common Stock,Industrials,Consumer Electronics/Appliances
PTICU,PropTech Investment Corporation II Unit,Industrials,Consumer Electronics/Appliances
PTICW,PropTech Investment Corporation II Warrant,Industrials,Consumer Electronics/Appliances
PTIX,Protagenic Therapeutics Inc. Common Stock,Health Care,Biotechnology: Pharmaceutical Preparations
PTIXW,Protagenic Therapeutics Inc. Warrant,Health Care,Biotechnology: Pharmaceutical Preparations
PTLO,Portillo's Inc. Class A Common Stock,Consumer Discretionary,Restaurants
PTMN,Portman Ridge Finance Corporation Common Stock,Finance,Finance/Investors Services
PTN,Palatin Technologies Inc. Common Stock,Health Care,Biotechnology: Pharmaceutical Preparations
PTNR,Partner Communications Company Ltd. American Depositary Shares,Telecommunications,Telecommunications Equipment
PTOC,Pine Technology Acquisition Corp. Class A Common Stock,Industrials,Consumer Electronics/Appliances
PTOCW,Pine Technology Acquisition Corp. Warrant,Industrials,Consumer Electronics/Appliances
PTON,Peloton Interactive Inc. Class A Common Stock,Consumer Discretionary,Other Consumer Services
PTPI,Petros Pharmaceuticals Inc. Common Stock,Health Care,Biotechnology: Pharmaceutical Preparations
PTRA,Proterra Inc. Common Stock,Consumer Discretionary,Auto Manufacturing
PTRS,Partners Bancorp Common Stock,Finance,Major Banks
PTSI,P.A.M. Transportation Services Inc. Common Stock,Industrials,Trucking Freight/Courier Services
PTVE,Pactiv Evergreen Inc. Common stock,Consumer Discretionary,Containers/Packaging
PTWOU,Pono Capital Two Inc. Unit,Industrials,Consumer Electronics/Appliances
PTY,Pimco Corporate & Income Opportunity Fund,Finance,Investment Managers
PUBM,PubMatic Inc. Class A Common Stock,Technology,Computer Software: Prepackaged Software
PUCK,Goal Acquisitions Corp. Common Stock,Industrials,Consumer Electronics/Appliances
PUCKU,Goal Acquisitions Corp. Unit,Industrials,Consumer Electronics/Appliances
PUCKW,Goal Acquisitions Corp. Warrant,Industrials,Consumer Electronics/Appliances
PUK,Prudential Public Limited Company Common Stock,Finance,Life Insurance
PULM,Pulmatrix Inc. Common Stock,Health Care,Biotechnology: Pharmaceutical Preparations
PUMP,ProPetro Holding Corp. Common Stock,Energy,Oilfield Services/Equipment
PUYI,Puyi Inc. American Depository Shares,Finance,Investment Managers
PV,Primavera Capital Acquisition Corporation Class A Ordinary Shares,Finance,Business Services
PVBC,Provident Bancorp Inc. (MD) Common Stock,Finance,Major Banks
PVH,PVH Corp. Common Stock,,
PVL,Permianville Royalty Trust Trust Units,Energy,Oil & Gas Production
PW,Power REIT (MD) Common Stock,Real Estate,Real Estate Investment Trusts
PW^A,Power REIT 7.75% Series A Cumulative Perpetual Preferred Stock,,
PWFL,PowerFleet Inc. Common Stock,Telecommunications,Telecommunications Equipment
PWOD,Penns Woods Bancorp Inc. Common Stock,Finance,Major Banks
PWP,Perella Weinberg Partners Class A Common Stock,Finance,Investment Bankers/Brokers/Service
PWR,Quanta Services Inc. Common Stock,Industrials,Engineering & Construction
PWSC,PowerSchool Holdings Inc. Class A Common Stock,Technology,Computer Software: Prepackaged Software
PWUP,PowerUp Acquisition Corp. Class A Ordinary Shares,,
PWUPU,PowerUp Acquisition Corp. Unit,,
PWUPW,PowerUp Acquisition Corp. Warrant,,
PX,P10 Inc. Class A Common Stock,Finance,Investment Managers
PXD,Pioneer Natural Resources Company Common Stock,Energy,Oil & Gas Production
PXLW,Pixelworks Inc.  Common Stock,Technology,Semiconductors
PXMD,PaxMedica Inc. Common Stock,Health Care,Medicinal Chemicals and Botanical Products
PXS,Pyxis Tankers Inc. Common Stock,Consumer Discretionary,Marine Transportation
PXSAP,Pyxis Tankers Inc. 7.75% Series A Cumulative Convertible Preferred Shares,Consumer Discretionary,Marine Transportation
PXSAW,Pyxis Tankers Inc. Warrant,Consumer Discretionary,Marine Transportation
PYCR,Paycor HCM Inc. Common Stock,Technology,Computer Software: Prepackaged Software
PYN,PIMCO New York Municipal Income Fund III Common Shares of Beneficial Interest,Finance,Investment Managers
PYPD,PolyPid Ltd. Ordinary Shares,Health Care,Medical/Dental Instruments
PYPL,PayPal Holdings Inc. Common Stock,Consumer Discretionary,Business Services
PYR,PyroGenesis Canada Inc. Common Shares,,
PYS,Merrill Lynch Depositor Inc PPlus Tr Ser RRD-1 Tr Ctf Cl A,Finance,Trusts Except Educational Religious and Charitable
PYT,PPlus Tr GSC-2 Tr Ctf Fltg Rate,,
PYXS,Pyxis Oncology Inc. Common Stock,Health Care,Biotechnology: Pharmaceutical Preparations
PZC,PIMCO California Municipal Income Fund III Common Shares of Beneficial Interest,Finance,Investment Managers
PZG,Paramount Gold Nevada Corp. Common Stock,Basic Materials,Precious Metals
PZN,Pzena Investment Management Inc Class A Common Stock,Finance,Investment Managers
PZZA,Papa John's International Inc. Common Stock,Consumer Discretionary,Restaurants
QBTS,D-Wave Quantum Inc. Common Shares,Technology,Retail: Computer Software & Peripheral Equipment
QCOM,QUALCOMM Incorporated Common Stock,Technology,Computer peripheral equipment
QCRH,QCR Holdings Inc. Common Stock,Finance,Major Banks
QD,Qudian Inc. American Depositary Shares each representing one Class A Ordinary Share,Technology,Computer Software: Prepackaged Software
QDEL,QuidelOrtho Corporation Common Stock,Health Care,Medical/Dental Instruments
QFIN,360 DigiTech Inc. American Depositary Shares,Finance,Finance: Consumer Services
QFTA,Quantum FinTech Acquisition Corporation Common Stock,Industrials,Consumer Electronics/Appliances
QGEN,Qiagen N.V. Common Shares,Health Care,Biotechnology: Biological Products (No Diagnostic Substances)
QH,Quhuo Limited American Depository Shares,Consumer Discretionary,Business Services
QIPT,Quipt Home Medical Corp. Common Shares,,
QK,Q&K International Group Limited American Depositary Shares,Finance,Real Estate
QLGN,Qualigen Therapeutics Inc. Common Stock,Health Care,Biotechnology: Commercial Physical & Biological Resarch
QLI,Qilian International Holding Group Ltd. Ordinary Shares,Health Care,Biotechnology: Pharmaceutical Preparations
QLYS,Qualys Inc. Common Stock,Technology,EDP Services
QMCO,Quantum Corporation Common Stock,Technology,Electronic Components
QNCX,Quince Therapeutics Inc. Common Stock,Health Care,Biotechnology: Biological Products (No Diagnostic Substances)
QNGY,Quanergy Systems Inc. Common Stock,Industrials,Industrial Machinery/Components
QNRX,Quoin Pharmaceuticals Ltd. American Depositary Shares,Health Care,Medical/Dental Instruments
QNST,QuinStreet Inc. Common Stock,Consumer Discretionary,Advertising
QQQX,Nuveen NASDAQ 100 Dynamic Overwrite Fund Shares of Beneficial Interest,Finance,Finance Companies
QRHC,Quest Resource Holding Corporation Common Stock,Consumer Discretionary,Building Products
QRTEA,Qurate Retail Inc. Series A Common Stock,Consumer Discretionary,Catalog/Specialty Distribution
QRTEB,Qurate Retail Inc. Series B Common Stock,Consumer Discretionary,Catalog/Specialty Distribution
QRTEP,Qurate Retail Inc. 8.0% Fixed Rate Cumulative Redeemable Preferred Stock,Consumer Discretionary,Catalog/Specialty Distribution
QRVO,Qorvo Inc. Common Stock,Industrials,Industrial Machinery/Components
QS,QuantumScape Corporation Class A Common Stock,Consumer Discretionary,Auto Parts:O.E.M.
QSI,Quantum-Si Incorporated Class A Common Stock,Health Care,Biotechnology: Pharmaceutical Preparations
QSIAW,Quantum-Si Incorporated Warrant,Health Care,Biotechnology: Pharmaceutical Preparations
QSR,Restaurant Brands International Inc. Common Shares,,
QTEK,QualTek Services Inc. Class A Common Stock,Consumer Discretionary,Telecommunications Equipment
QTEKW,QualTek Services Inc. Warrant,Consumer Discretionary,Telecommunications Equipment
QTNT,Quotient Limited Ordinary Shares,Health Care,Biotechnology: In Vitro & In Vivo Diagnostic Substances
QTRX,Quanterix Corporation Common Stock,Health Care,Industrial Specialties
QTT,Qutoutiao Inc. American Depositary Shares,Technology,Computer Software: Prepackaged Software
QTWO,Q2 Holdings Inc. Common Stock,Technology,EDP Services
QUAD,Quad Graphics Inc Class A Common Stock,Consumer Discretionary,Recreational Games/Products/Toys
QUBT,Quantum Computing Inc. Common Stock,Technology,Computer Manufacturing
QUIK,QuickLogic Corporation Common Stock,Technology,Semiconductors
QUMU,Qumu Corporation Common Stock,Technology,Retail: Computer Software & Peripheral Equipment
QUOT,Quotient Technology Inc. Common Stock,Consumer Discretionary,Advertising
QURE,uniQure N.V. Ordinary Shares,Health Care,Biotechnology: Pharmaceutical Preparations
QVCC,QVC Inc. 6.250% Senior Secured Notes due 2068,,
QVCD,QVC Inc. 6.375% Senior Secured Notes due 2067,,
R,Ryder System Inc. Common Stock,Consumer Discretionary,Rental/Leasing Companies
RA,Brookfield Real Assets Income Fund Inc. Common Stock,Finance,Investment Managers
RAAS,Cloopen Group Holding Limited American Depositary Shares each representing two Class A Ordinary Shares,Technology,Computer Software: Prepackaged Software
RACB,Research Alliance Corp. II Class A Common Stock,Industrials,Consumer Electronics/Appliances
RACE,Ferrari N.V. Common Shares,Consumer Discretionary,Auto Manufacturing
RACY,Relativity Acquisition Corp. Class A Common Stock,Industrials,Consumer Electronics/Appliances
RACYU,Relativity Acquisition Corp. Unit,Industrials,Consumer Electronics/Appliances
RAD,Rite Aid Corporation Common Stock,Consumer Staples,Retail-Drug Stores and Proprietary Stores
RADA,RADA Electronic Industries Ltd. Ordinary Shares,Technology,Electronic Components
RADI,Radius Global Infrastructure Inc. Class A Common Stock,Consumer Discretionary,Telecommunications Equipment
RAIL,FreightCar America Inc. Common Stock,Industrials,Railroads
RAIN,Rain Therapeutics Inc. Common Stock,Health Care,Biotechnology: Pharmaceutical Preparations
RAM,Aries I Acquisition Corporation Class A Ordinary Share,Finance,Business Services
RAMMU,Aries I Acquisition Corporation Unit,Finance,Business Services
RAMMW,Aries I Acquisition Corporation Warrant,Finance,Business Services
RAMP,LiveRamp Holdings Inc. Common Stock,Technology,EDP Services
RAND,Rand Capital Corporation Common Stock,Finance,Finance/Investors Services
RANI,Rani Therapeutics Holdings Inc. Class A Common Stock,Health Care,Medicinal Chemicals and Botanical Products
RAPT,RAPT Therapeutics Inc. Common Stock,Health Care,Biotechnology: Pharmaceutical Preparations
RARE,Ultragenyx Pharmaceutical Inc. Common Stock,Health Care,Biotechnology: Pharmaceutical Preparations
RAVE,Rave Restaurant Group Inc. Common Stock,Consumer Discretionary,Restaurants
RBA,Ritchie Bros. Auctioneers Incorporated Common Stock,,
RBB,RBB Bancorp Common Stock,Finance,Commercial Banks
RBBN,Ribbon Communications Inc. Common Stock,Technology,EDP Services
RBCAA,Republic Bancorp Inc. Class A Common Stock,Finance,Major Banks
RBCN,Rubicon Technology Inc. Common Stock,Technology,Semiconductors
RBKB,Rhinebeck Bancorp Inc. Common Stock,Finance,Major Banks
RBLX,Roblox Corporation Class A Common Stock,Technology,EDP Services
RBOT,Vicarious Surgical Inc. Class A Common Stock,Health Care,Medical Specialities
RBT,Rubicon Technologies Inc. Class A Common Stock,Technology,EDP Services
RC,Ready Capital Corproation Common Stock,Real Estate,Real Estate Investment Trusts
RC^C,Ready Capital Corporation 6.25% Series C Cumulative Convertible Preferred Stock,,
RC^E,Ready Capital Corporation 6.50% Series E Cumulative Redeemable Preferred Stock,,
RCA,Ready Capital Corporation 7.00% Convertible Senior Notes due 2023,Real Estate,Real Estate Investment Trusts
RCAC,Revelstone Capital Acquisition Corp. Class A Common Stock,Industrials,Consumer Electronics/Appliances
RCACU,Revelstone Capital Acquisition Corp. Unit,Industrials,Consumer Electronics/Appliances
RCACW,Revelstone Capital Acquisition Corp. Warrant,Industrials,Consumer Electronics/Appliances
RCAT,Red Cat Holdings Inc. Common Stock,Industrials,Wholesale Distributors
RCB,Ready Capital Corporation 6.20% Senior Notes due 2026,,
RCC,Ready Capital Corporation 5.75% Senior Notes due 2026,Finance,Finance Companies
RCEL,Avita Medical Inc. Common Stock,Health Care,Medical Specialities
RCFA,RCF Acquisition Corp. Class A Ordinary Shares,,
RCG,RENN Fund Inc Common Stock,Finance,Investment Managers
RCHG,Recharge Acquisition Corp. Class A Common Stock,Industrials,Consumer Electronics/Appliances
RCHGU,Recharge Acquisition Corp. Unit,Industrials,Consumer Electronics/Appliances
RCHGW,Recharge Acquisition Corp. Warrant,Industrials,Consumer Electronics/Appliances
RCI,Rogers Communication Inc. Common Stock,,
RCII,Rent-A-Center Inc. Common Stock,Consumer Discretionary,Diversified Commercial Services
RCKT,Rocket Pharmaceuticals Inc. Common Stock,Health Care,Biotechnology: Pharmaceutical Preparations
RCKY,Rocky Brands Inc. Common Stock,Consumer Discretionary,Shoe Manufacturing
RCL,D/B/A Royal Caribbean Cruises Ltd. Common Stock,Consumer Discretionary,Hotels/Resorts
RCLF,Rosecliff Acquisition Corp I Class A Common Stock,Industrials,Consumer Electronics/Appliances
RCLFU,Rosecliff Acquisition Corp I Unit,Industrials,Consumer Electronics/Appliances
RCLFW,Rosecliff Acquisition Corp I Warrants,Industrials,Consumer Electronics/Appliances
RCM,R1 RCM Inc. Common Stock,Consumer Discretionary,Other Consumer Services
RCMT,RCM Technologies Inc. Common Stock,Industrials,Consumer Electronics/Appliances
RCON,Recon Technology Ltd. Class A Ordinary Shares,Energy,Oilfield Services/Equipment
RCOR,Renovacor Inc. Common Stock,Health Care,Biotechnology: Pharmaceutical Preparations
RCRT,Recruiter.com Group Inc. Common Stock,Technology,Interactive Media
RCS,PIMCO Strategic Income Fund Inc.,Finance,Investment Managers
RCUS,Arcus Biosciences Inc. Common Stock,Health Care,Biotechnology: Pharmaceutical Preparations
RDCM,Radcom Ltd. Ordinary Shares,Technology,Computer peripheral equipment
RDFN,Redfin Corporation Common Stock,Finance,Real Estate
RDHL,Redhill Biopharma Ltd. American Depositary Shares,Health Care,Biotechnology: Pharmaceutical Preparations
RDI,Reading International Inc Class A Common Stock,Consumer Discretionary,Movies/Entertainment
RDIB,Reading International Inc Class B Common Stock,Consumer Discretionary,Movies/Entertainment
RDN,Radian Group Inc. Common Stock,Finance,Property-Casualty Insurers
RDNT,RadNet Inc. Common Stock,Health Care,Medical Specialities
RDVT,Red Violet Inc. Common Stock,Technology,Computer Software: Prepackaged Software
RDW,Redwire Corporation Common Stock,Industrials,Aerospace
RDWR,Radware Ltd. Ordinary Shares,Technology,EDP Services
RDY,Dr. Reddy's Laboratories Ltd Common Stock,Health Care,Biotechnology: Pharmaceutical Preparations
RE,Everest Re Group Ltd. Common Stock,Finance,Property-Casualty Insurers
REAL,The RealReal Inc. Common Stock,Consumer Discretionary,Consumer Specialties
REAX,The Real Brokerage Inc. Common Shares,,
REBN,Reborn Coffee Inc. Common Stock,Consumer Discretionary,Restaurants
REE,REE Automotive Ltd. Class A Ordinary Shares,Consumer Discretionary,Auto Manufacturing
REEAW,REE Automotive Ltd. Warrant,Consumer Discretionary,Auto Manufacturing
REED,Reeds Inc. Common Stock,Consumer Staples,Beverages (Production/Distribution)
REFI,Chicago Atlantic Real Estate Finance Inc. Common Stock,Real Estate,Real Estate Investment Trusts
REFR,Research Frontiers Incorporated Common Stock,Technology,Industrial Machinery/Components
REG,Regency Centers Corporation Common Stock,Real Estate,Real Estate Investment Trusts
REGN,Regeneron Pharmaceuticals Inc. Common Stock,Health Care,Biotechnology: Pharmaceutical Preparations
REI,Ring Energy Inc. Common Stock,Energy,Oil & Gas Production
REKR,Rekor Systems Inc. Common Stock,Technology,EDP Services
RELI,Reliance Global Group Inc. Common Stock,Finance,Specialty Insurers
RELIW,Reliance Global Group Inc. Series A Warrants,Finance,Specialty Insurers
RELL,Richardson Electronics Ltd. Common Stock,Technology,Electronic Components
RELX,RELX PLC PLC American Depositary Shares (Each representing One Ordinary Share),Consumer Discretionary,Business Services
RELY,Remitly Global Inc. Common Stock,Technology,Computer Software: Prepackaged Software
RENE,Cartesian Growth Corporation II Class A Ordinary Shares,,
RENEU,Cartesian Growth Corporation II Unit,,
RENEW,Cartesian Growth Corporation II Warrant,,
RENN,Renren Inc. American Depositary Shares each representing fifteen Class A ordinary shares,Technology,EDP Services
RENT,Rent the Runway Inc. Class A Common Stock,Consumer Discretionary,Department/Specialty Retail Stores
REPL,Replimune Group Inc. Common Stock,Health Care,Biotechnology: Pharmaceutical Preparations
REPX,Riley Exploration Permian Inc. Common Stock,Energy,Oil & Gas Production
RERE,ATRenew Inc. American Depositary Shares (every three of which representing two Class A ordinary shares),,
RES,RPC Inc. Common Stock,Energy,Oilfield Services/Equipment
RETA,Reata Pharmaceuticals Inc. Class A Common Stock,Health Care,Biotechnology: Pharmaceutical Preparations
RETO,ReTo Eco-Solutions Inc. Common Shares,Consumer Discretionary,Multi-Sector Companies
REUN,Reunion Neuroscience Inc. Common Shares,Health Care,Medicinal Chemicals and Botanical Products
REV,Revlon Inc. New Common Stock,Consumer Discretionary,Package Goods/Cosmetics
REVB,Revelation Biosciences Inc. Common Stock,Health Care,Biotechnology: Pharmaceutical Preparations
REVBU,Revelation Biosciences Inc. Unit,Health Care,Biotechnology: Pharmaceutical Preparations
REVBW,Revelation Biosciences Inc. Warrant,Health Care,Biotechnology: Pharmaceutical Preparations
REVE,Alpine Acquisition Corporation Common Stock,Industrials,Consumer Electronics/Appliances
REVEW,Alpine Acquisition Corporation Warrant,Industrials,Consumer Electronics/Appliances
REVG,REV Group Inc. Common Stock,Industrials,Industrial Machinery/Components
REVH,Revolution Healthcare Acquisition Corp. SAIL Class A Common Stock,Industrials,Consumer Electronics/Appliances
REVHU,Revolution Healthcare Acquisition Corp. SAIL Units,Industrials,Consumer Electronics/Appliances
REVHW,Revolution Healthcare Acquisition Corp. SAIL Warrant.,Industrials,Consumer Electronics/Appliances
