symbol,name,sector,industry
DDL,Dingdong (Cayman) Limited American Depositary Shares (each two representing three Ordinary Shares),,
DDOG,Datadog Inc. Class A Common Stock,Technology,EDP Services
DDS,Dillard's Inc. Common Stock,Consumer Discretionary,Department/Specialty Retail Stores
DDT,Dillard's Capital Trust I,Consumer Discretionary,Department/Specialty Retail Stores
DE,Deere & Company Common Stock,Industrials,Industrial Machinery/Components
DEA,Easterly Government Properties Inc. Common Stock,Real Estate,Real Estate Investment Trusts
DECAU,Denali Capital Acquisition Corp. Unit,,
DECK,Deckers Outdoor Corporation Common Stock,Consumer Discretionary,Shoe Manufacturing
DEI,Douglas Emmett Inc. Common Stock,Real Estate,Real Estate Investment Trusts
DELL,Dell Technologies Inc. Class C Common Stock,Technology,Computer Manufacturing
DEN,Denbury Inc. Common Stock,Energy,Oil & Gas Production
DENN,Denny's Corporation Common Stock,Consumer Discretionary,Restaurants
DEO,Diageo plc Common Stock,Consumer Staples,Beverages (Production/Distribution)
DERM,Journey Medical Corporation Common Stock,Health Care,Biotechnology: Pharmaceutical Preparations
DESP,Despegar.com Corp. Ordinary Shares,Consumer Discretionary,Other Consumer Services
DEX,Delaware Enhanced Global Dividend Common Shares of Beneficial Interest,Finance,Finance Companies
DFFN,Diffusion Pharmaceuticals Inc. Common Stock,Health Care,Biotechnology: Pharmaceutical Preparations
DFH,Dream Finders Homes Inc. Class A Common Stock,,
DFIN,Donnelley Financial Solutions Inc. Common Stock,Finance,Investment Managers
DFP,Flaherty & Crumrine Dynamic Preferred and Income Fund Inc. Common Stock,Finance,Investment Managers
DFS,Discover Financial Services Common Stock,Finance,Finance: Consumer Services
DG,Dollar General Corporation Common Stock,Consumer Discretionary,Department/Specialty Retail Stores
DGHI,Digihost Technology Inc. Common Subordinate Voting Shares,,
DGICA,Donegal Group Inc. Class A Common Stock,Finance,Property-Casualty Insurers
DGICB,Donegal Group Inc. Class B Common Stock,Finance,Property-Casualty Insurers
DGII,Digi International Inc. Common Stock,Technology,Computer peripheral equipment
DGLY,Digital Ally Inc. Common Stock,Technology,Security Systems Services
DGNU,Dragoneer Growth Opportunities Corp. III Class A Ordinary Shares,Finance,Business Services
DGX,Quest Diagnostics Incorporated Common Stock,Health Care,Medical Specialities
DH,Definitive Healthcare Corp. Class A Common Stock,Technology,Computer Software: Prepackaged Software
DHAC,Digital Health Acquisition Corp. Common Stock,Industrials,Consumer Electronics/Appliances
DHACW,Digital Health Acquisition Corp. Warrant,Industrials,Consumer Electronics/Appliances
DHBC,DHB Capital Corp. Class A common stock,Industrials,Consumer Electronics/Appliances
DHBCU,DHB Capital Corp. Unit,Industrials,Consumer Electronics/Appliances
DHBCW,DHB Capital Corp. Warrant,Industrials,Consumer Electronics/Appliances
DHC,Diversified Healthcare Trust Common Shares of Beneficial Interest,Real Estate,Real Estate Investment Trusts
DHCA,DHC Acquisition Corp. Class A ordinary share,Finance,Business Services
DHCAU,DHC Acquisition Corp. Unit,Finance,Business Services
DHCAW,DHC Acquisition Corp. Warrant,Finance,Business Services
DHCNI,Diversified Healthcare Trust 5.625% Senior Notes due 2042,Real Estate,Real Estate Investment Trusts
DHCNL,Diversified Healthcare Trust 6.25% Senior Notes Due 2046,Real Estate,Real Estate Investment Trusts
DHF,BNY Mellon High Yield Strategies Fund Common Stock,Finance,Finance Companies
DHHC,DiamondHead Holdings Corp. Class A Common Stock,Industrials,Consumer Electronics/Appliances
DHHCU,DiamondHead Holdings Corp. Unit,Industrials,Consumer Electronics/Appliances
DHHCW,DiamondHead Holdings Corp. Warrant,Industrials,Consumer Electronics/Appliances
DHI,D.R. Horton Inc. Common Stock,,
DHIL,Diamond Hill Investment Group Inc. Class A Common Stock,Finance,Investment Managers
DHR,Danaher Corporation Common Stock,Health Care,Medical Specialities
DHR^B,Danaher Corporation 5.00% Mandatory Convertible Preferred Stock Series B,,
DHT,DHT Holdings Inc.,Consumer Discretionary,Marine Transportation
DHX,DHI Group Inc. Common Stock,Consumer Discretionary,Diversified Commercial Services
DHY,Credit Suisse High Yield Bond Fund Common Stock,Finance,Finance/Investors Services
DIAX,Nuveen Dow 30SM Dynamic Overwrite Fund Common Shares of Beneficial Interest,Finance,Finance Companies
DIBS,1stdibs.com Inc. Common Stock,Miscellaneous,Diversified Commercial Services
DICE,DICE Therapeutics Inc. Common Stock,Health Care,Biotechnology: Pharmaceutical Preparations
DILA,DILA Capital Acquisition Corp. Class A Common Stock,Industrials,Consumer Electronics/Appliances
DILAU,DILA Capital Acquisition Corp. Unit,Industrials,Consumer Electronics/Appliances
DIN,Dine Brands Global Inc. Common Stock,Consumer Discretionary,Restaurants
DINO,HF Sinclair Corporation Common Stock,Energy,Integrated oil Companies
DIOD,Diodes Incorporated Common Stock,Technology,Semiconductors
DIS,Walt Disney Company (The) Common Stock,Consumer Discretionary,Movies/Entertainment
DISA,Disruptive Acquisition Corporation I Class A Ordinary Shares,Finance,Business Services
DISAU,Disruptive Acquisition Corporation I Unit,Finance,Business Services
DISAW,Disruptive Acquisition Corporation I Warrant,Finance,Business Services
DISH,DISH Network Corporation Class A Common Stock,Consumer Discretionary,Telecommunications Equipment
DIT,AMCON Distributing Company Common Stock,Consumer Discretionary,Food Distributors
DJCO,Daily Journal Corp. (S.C.) Common Stock,Technology,Retail: Computer Software & Peripheral Equipment
DK,Delek US Holdings Inc. Common Stock,Energy,Integrated oil Companies
DKDCA,Data Knights Acquisition Corp. Class A Common Stock,Industrials,Consumer Electronics/Appliances
DKDCU,Data Knights Acquisition Corp. Unit,Industrials,Consumer Electronics/Appliances
DKDCW,Data Knights Acquisition Corp. Warrant,Industrials,Consumer Electronics/Appliances
DKL,Delek Logistics Partners L.P. Common Units representing Limited Partner Interests,Energy,Oil & Gas Production
DKNG,DraftKings Inc. Class A Common Stock,Consumer Discretionary,Services-Misc. Amusement & Recreation
DKS,Dick's Sporting Goods Inc Common Stock,Consumer Discretionary,Other Specialty Stores
DLA,Delta Apparel Inc. Common Stock,Consumer Discretionary,Department/Specialty Retail Stores
DLB,Dolby Laboratories Common Stock,Technology,EDP Services
DLCA,Deep Lake Capital Acquisition Corp. Class A Ordinary Shares,Finance,Business Services
DLCAU,Deep Lake Capital Acquisition Corp. Unit,Finance,Business Services
DLCAW,Deep Lake Capital Acquisition Corp. Warrant,Finance,Business Services
DLHC,DLH Holdings Corp.,Consumer Discretionary,Business Services
DLNG,Dynagas LNG Partners LP Common Units,,
DLNG^A,Dynagas LNG Partners LP 9.00% Series A Cumulative Redeemable Preferred Units,,
DLNG^B,Dynagas LNG Partners LP 8.75% Series B Fixed to Floating Rate Cumulative Redeemable Perpetual Preferred Units liquidation preference $25.00 per Uni,,
DLO,DLocal Limited Class A Common Shares,,
DLPN,Dolphin Entertainment Inc. Common Stock,Technology,Interactive Media
DLR,Digital Realty Trust Inc. Common Stock,Real Estate,Real Estate Investment Trusts
DLR^J,Digital Realty Trust Inc. 5.250% Series J Cumulative Redeemable Preferred Stock,,
DLR^K,Digital Realty Trust Inc. 5.850% Series K Cumulative Redeemable Preferred Stock par value $0.01 per share,,
DLR^L,Digital Realty Trust Inc. 5.200% Series L Cumulative Redeemable Preferred Stock,,
DLTH,Duluth Holdings Inc. Class B Common Stock,Consumer Discretionary,Department/Specialty Retail Stores
DLTR,Dollar Tree Inc. Common Stock,Consumer Discretionary,Department/Specialty Retail Stores
DLX,Deluxe Corporation Common Stock,Consumer Discretionary,Advertising
DLY,DoubleLine Yield Opportunities Fund Common Shares of Beneficial Interest,Finance,Investment Managers
DM,Desktop Metal Inc. Class A Common Stock,Technology,Computer peripheral equipment
DMA,Destra Multi-Alternative Fund Common Stock,Finance,Trusts Except Educational Religious and Charitable
DMAC,DiaMedica Therapeutics Inc. Common Stock,Health Care,Medicinal Chemicals and Botanical Products
DMAQ,Deep Medicine Acquisition Corp. Class A Common Stock,Industrials,Consumer Electronics/Appliances
DMB,BNY Mellon Municipal Bond Infrastructure Fund Inc. Common Stock,Finance,Trusts Except Educational Religious and Charitable
DMF,BNY Mellon Municipal Income Inc. Common Stock,Finance,Finance/Investors Services
DMLP,Dorchester Minerals L.P. Common Units Representing Limited Partnership Interests,Energy,Oil & Gas Production
DMO,Western Asset Mortgage Opportunity Fund Inc. Common Stock,Finance,Trusts Except Educational Religious and Charitable
DMRC,Digimarc Corporation Common Stock,Technology,EDP Services
DMS,Digital Media Solutions Inc. Class A Ordinary Shares,Consumer Discretionary,Advertising
DMTK,DermTech Inc. Common Stock,Health Care,Managed Health Care
DMYS,dMY Technology Group Inc. VI Class A Common Stock,Industrials,Consumer Electronics/Appliances
DNA,Ginkgo Bioworks Holdings Inc. Class A Common Stock,Health Care,Biotechnology: Biological Products (No Diagnostic Substances)
DNAB,Social Capital Suvretta Holdings Corp. II Class A Ordinary Shares,,
DNAD,Social Capital Suvretta Holdings Corp. IV Class A Ordinary Shares,Health Care,Biotechnology: Pharmaceutical Preparations
DNAY,Codex DNA Inc. Common Stock,Health Care,Medical Specialities
DNB,Dun & Bradstreet Holdings Inc. Common Stock,Technology,Internet and Information Services
DNLI,Denali Therapeutics Inc. Common Stock,Health Care,Biotechnology: Biological Products (No Diagnostic Substances)
DNMR,Danimer Scientific Inc. Common Stock,Industrials,Plastic Products
DNN,Denison Mines Corp Ordinary Shares (Canada),,
DNOW,NOW Inc. Common Stock,Industrials,Metal Fabrications
DNP,DNP Select Income Fund Inc. Common Stock,Finance,Investment Managers
DNUT,Krispy Kreme Inc. Common Stock,Consumer Discretionary,Specialty Foods
DNZ,D and Z Media Acquisition Corp. Class A Common Stock,Industrials,Consumer Electronics/Appliances
DO,Diamond Offshore Drilling Inc. Common Stock,Energy,Oil & Gas Production
DOC,Physicians Realty Trust Common Shares of Beneficial Interest,Real Estate,Real Estate Investment Trusts
DOCN,DigitalOcean Holdings Inc. Common Stock,Technology,Retail: Computer Software & Peripheral Equipment
DOCS,Doximity Inc. Class A Common Stock,Technology,Retail: Computer Software & Peripheral Equipment
DOCU,DocuSign Inc. Common Stock,Technology,EDP Services
DOGZ,Dogness (International) Corporation Class A Common Stock,Consumer Discretionary,Miscellaneous manufacturing industries
DOLE,Dole plc Ordinary Shares,,
DOMA,Doma Holdings Inc. Common Stock,Finance,Real Estate
DOMO,Domo Inc. Class B Common Stock,Technology,Computer Software: Prepackaged Software
DOOO,BRP Inc. (Recreational Products) Common Subordinate Voting Shares,,
DOOR,Masonite International Corporation Ordinary Shares (Canada),,
DORM,Dorman Products Inc. Common Stock,Consumer Discretionary,Auto Parts:O.E.M.
DOUG,Douglas Elliman Inc. Common Stock,Real Estate,Building operators
DOV,Dover Corporation Common Stock,Industrials,Industrial Machinery/Components
DOW,Dow Inc. Common Stock,Industrials,Industrial Specialties
DOX,Amdocs Limited Ordinary Shares,Technology,EDP Services
DOYU,DouYu International Holdings Limited ADS,Technology,Computer Software: Programming Data Processing
DPCS,DP Cap Acquisition Corp I Class A Ordinary Shares,,
DPCSU,DP Cap Acquisition Corp I Unit,,
DPCSW,DP Cap Acquisition Corp I Warrants,,
DPG,Duff & Phelps Utility and Infrastructure Fund Inc.,Finance,Trusts Except Educational Religious and Charitable
DPRO,Draganfly Inc. Common Shares,Consumer Discretionary,Electronic Components
DPSI,DecisionPoint Systems Inc. Common Stock,Technology,Retail: Computer Software & Peripheral Equipment
DPZ,Domino's Pizza Inc Common Stock,Consumer Discretionary,Food Distributors
DQ,DAQO New Energy Corp. American Depositary Shares each representing five ordinary shares,Technology,Semiconductors
DRAY,Macondray Capital Acquisition Corp. I Class A Ordinary Shares,,
DRAYU,Macondray Capital Acquisition Corp. I Unit,,
DRAYW,Macondray Capital Acquisition Corp. I Warrant,,
DRCT,Direct Digital Holdings Inc. Class A Common Stock,Consumer Discretionary,Advertising
DRD,DRDGOLD Limited American Depositary Shares,Basic Materials,Precious Metals
DRE,Duke Realty Corporation Common Stock,Real Estate,Real Estate Investment Trusts
DRH,Diamondrock Hospitality Company Common Stock,Real Estate,Real Estate Investment Trusts
DRH^A,Diamondrock Hospitality Company 8.250% Series A Cumulative Redeemable Preferred Stock,,
DRI,Darden Restaurants Inc. Common Stock,Consumer Discretionary,Restaurants
DRIO,DarioHealth Corp. Common Stock,Health Care,Medical/Dental Instruments
DRMA,Dermata Therapeutics Inc. Common Stock,Health Care,Biotechnology: Pharmaceutical Preparations
DRMAW,Dermata Therapeutics Inc. Warrant,Health Care,Biotechnology: Pharmaceutical Preparations
DRQ,Dril-Quip Inc. Common Stock,Industrials,Metal Fabrications
DRRX,DURECT Corporation Common Stock,Health Care,Biotechnology: Pharmaceutical Preparations
DRTS,Alpha Tau Medical Ltd. Ordinary Shares,Health Care,Biotechnology: Pharmaceutical Preparations
DRTSW,Alpha Tau Medical Ltd. Warrant,Finance,Business Services
DRTT,DIRTT Environmental Solutions Ltd. Common Shares,,
DRUG,Bright Minds Biosciences Inc. Common Stock,Health Care,Medicinal Chemicals and Botanical Products
DRVN,Driven Brands Holdings Inc. Common Stock,,
DS,Drive Shack Inc.,Consumer Discretionary,Movies/Entertainment
DS^B,Drive Shack Inc. Preferred Series B,,
DS^C,Drive Shack Inc. Preferred Series C,,
DS^D,Drive Shack Inc. Pfd Ser D,,
DSAQ,Direct Selling Acquisition Corp. Class A Common Stock,Industrials,Consumer Electronics/Appliances
DSEY,Diversey Holdings Ltd. Ordinary Shares,Consumer Discretionary,Specialty Chemicals
DSGN,Design Therapeutics Inc. Common Stock,Health Care,Biotechnology: Pharmaceutical Preparations
DSGR,Distribution Solutions Group Inc. Common Stock,Industrials,Industrial Machinery/Components
DSGX,Descartes Systems Group Inc. (The) Common Stock,,
DSKE,Daseke Inc. Common Stock,,
DSL,DoubleLine Income Solutions Fund Common Shares of Beneficial Interests,Finance,Trusts Except Educational Religious and Charitable
DSM,BNY Mellon Strategic Municipal Bond Fund Inc. Common Stock,Finance,Investment Managers
DSP,Viant Technology Inc. Class A Common Stock,Technology,EDP Services
DSS,DSS Inc. Common Stock,,
DSU,Blackrock Debt Strategies Fund Inc. Common Stock,Finance,Finance Companies
DSWL,Deswell Industries Inc. Common Shares,Industrials,Plastic Products
DSX,Diana Shipping inc. common stock,Consumer Discretionary,Marine Transportation
DSX^B,Diana Shipping Inc. Perpetual Preferred Shares Series B (Marshall Islands),,
DT,Dynatrace Inc. Common Stock,Technology,EDP Services
DTB,DTE Energy Company 2020 Series G 4.375% Junior Subordinated Debentures due 2080,Utilities,Electric Utilities: Central
DTC,Solo Brands Inc. Class A Common Stock,Miscellaneous,Diversified Commercial Services
DTE,DTE Energy Company Common Stock,Utilities,Electric Utilities: Central
DTEA,DAVIDsTEA Inc. Common Stock,,
DTF,DTF Tax-Free Income 2028 Term Fund Inc. Common Stock,Finance,Investment Managers
DTG,DTE Energy Company 2021 Series E 4.375% Junior Subordinated Debentures,Utilities,Electric Utilities: Central
DTIL,Precision BioSciences Inc. Common Stock,Health Care,Biotechnology: Pharmaceutical Preparations
DTLA^,Brookfield DTLA Inc. 7.625% Series A Cumulative Redeemable Preferred Stock,,
DTM,DT Midstream Inc. Common Stock,Utilities,Oil & Gas Production
DTOC,Digital Transformation Opportunities Corp. Class A Common Stock,Industrials,Consumer Electronics/Appliances
DTOCU,Digital Transformation Opportunities Corp. Units,Industrials,Consumer Electronics/Appliances
DTOCW,Digital Transformation Opportunities Corp. Warrant,Industrials,Consumer Electronics/Appliances
DTP,DTE Energy Company 6.25% Corporate Units,Utilities,Electric Utilities: Central
DTRT,DTRT Health Acquisition Corp. Class A Common Stock,Industrials,Consumer Electronics/Appliances
DTRTU,DTRT Health Acquisition Corp. Unit,Industrials,Consumer Electronics/Appliances
DTRTW,DTRT Health Acquisition Corp. Warrant,Industrials,Consumer Electronics/Appliances
DTSS,Datasea Inc. Common Stock,Technology,Retail: Computer Software & Peripheral Equipment
DTST,Data Storage Corporation Common Stock,Technology,EDP Services
DTSTW,Data Storage Corporation Warrant,Technology,EDP Services
DTW,DTE Energy Company 2017 Series E 5.25% Junior Subordinated Debentures due 2077,Utilities,Electric Utilities: Central
DUET,DUET Acquisition Corp. Class A Common Stock,Miscellaneous,Other Pharmaceuticals
DUETU,DUET Acquisition Corp. Unit,Miscellaneous,Other Pharmaceuticals
DUETW,DUET Acquisition Corp. Warrant,Miscellaneous,Other Pharmaceuticals
DUK,Duke Energy Corporation (Holding Company) Common Stock,Utilities,Power Generation
DUK^A,Duke Energy Corporation Depositary Shares each representing a 1/1000th interest in a share of 5.75% Series A Cumulative Redeemable Perpetual Preferred Stock,,
DUKB,Duke Energy Corporation 5.625% Junior Subordinated Debentures due 2078,Utilities,Power Generation
DUNE,Dune Acquisition Corporation Class A Common Stock,Industrials,Consumer Electronics/Appliances
DUNEU,Dune Acquisition Corporation Unit,Industrials,Consumer Electronics/Appliances
DUNEW,Dune Acquisition Corporation Warrant,Industrials,Consumer Electronics/Appliances
DUO,Fangdd Network Group Ltd. American Depositary Shares,Technology,Computer Software: Programming Data Processing
DUOL,Duolingo Inc. Class A Common Stock,Technology,Computer Software: Prepackaged Software
DUOT,Duos Technologies Group Inc. Common Stock,Technology,Computer Software: Prepackaged Software
DV,DoubleVerify Holdings Inc. Common Stock,Technology,Computer Software: Prepackaged Software
DVA,DaVita Inc. Common Stock,Health Care,Medical/Nursing Services
DVAX,Dynavax Technologies Corporation Common Stock,Health Care,Biotechnology: Pharmaceutical Preparations
DVN,Devon Energy Corporation Common Stock,Energy,Oil & Gas Production
DWAC,Digital World Acquisition Corp. Class A Common Stock,Industrials,Consumer Electronics/Appliances
DWACU,Digital World Acquisition Corp. Units,Industrials,Consumer Electronics/Appliances
DWACW,Digital World Acquisition Corp. Warrants,Industrials,Consumer Electronics/Appliances
DWSN,Dawson Geophysical Company Common Stock,Energy,Oil & Gas Production
DX,Dynex Capital Inc. Common Stock,Real Estate,Real Estate Investment Trusts
DX^C,Dynex Capital Inc. 6.900% Series C Fixed-to-Floating Rate Cumulative Redeemable Preferred Stock,,
DXC,DXC Technology Company Common Stock,Technology,EDP Services
DXCM,DexCom Inc. Common Stock,Health Care,Medical Specialities
DXF,Dunxin Financial Holdings Limited American Depositary Shares,Consumer Discretionary,Apparel
DXLG,Destination XL Group Inc. Common Stock,Consumer Discretionary,Clothing/Shoe/Accessory Stores
DXPE,DXP Enterprises Inc. Common Stock,Industrials,Industrial Machinery/Components
DXR,Daxor Corporation Common Stock,Health Care,Medical/Dental Instruments
DXYN,Dixie Group Inc. (The) Common Stock,Consumer Discretionary,Home Furnishings
DY,Dycom Industries Inc. Common Stock,Industrials,Water Sewer Pipeline Comm & Power Line Construction
DYAI,Dyadic International Inc. Common Stock,Health Care,Biotechnology: Biological Products (No Diagnostic Substances)
DYN,Dyne Therapeutics Inc. Common Stock,Health Care,Medicinal Chemicals and Botanical Products
DYNT,Dynatronics Corporation Common Stock,Health Care,Medical/Dental Instruments
DZSI,DZS Inc. Common Stock,Utilities,Telecommunications Equipment
E,ENI S.p.A. Common Stock,Energy,Oil & Gas Production
EA,Electronic Arts Inc. Common Stock,Consumer Discretionary,Recreational Games/Products/Toys
EAC,Edify Acquisition Corp. Class A Common Stock,Industrials,Consumer Electronics/Appliances
EACPU,Edify Acquisition Corp. Units,Industrials,Consumer Electronics/Appliances
EACPW,Edify Acquisition Corp. Warrant,Industrials,Consumer Electronics/Appliances
EAD,Allspring Income Opportunities Fund Common Shares,Finance,Finance/Investors Services
EAF,GrafTech International Ltd. Common Stock,Consumer Discretionary,Metal Fabrications
EAI,Entergy Arkansas LLC First Mortgage Bonds 4.875% Series Due September 1 2066,,
EAR,Eargo Inc. Common Stock,Health Care,Medical Specialities
EARN,Ellington Residential Mortgage REIT Common Shares of Beneficial Interest,Real Estate,Real Estate Investment Trusts
EAST,Eastside Distilling Inc. Common Stock,Consumer Staples,Beverages (Production/Distribution)
EAT,Brinker International Inc. Common Stock,Consumer Discretionary,Restaurants
EB,Eventbrite Inc. Class A Common Stock,Technology,EDP Services
EBAC,European Biotech Acquisition Corp. Class A Ordinary Shares,Finance,Business Services
EBACU,European Biotech Acquisition Corp. Units,Finance,Business Services
EBACW,European Biotech Acquisition Corp. Warrant,Finance,Business Services
EBAY,eBay Inc. Common Stock,Consumer Discretionary,Catalog/Specialty Distribution
EBC,Eastern Bankshares Inc. Common Stock,Finance,Major Banks
EBET,EBET INC. Common Stock,Consumer Discretionary,Services-Misc. Amusement & Recreation
EBF,Ennis Inc. Common Stock,Consumer Discretionary,Office Equipment/Supplies/Services
EBIX,Ebix Inc. Common Stock,Technology,EDP Services
EBMT,Eagle Bancorp Montana Inc. Common Stock,Finance,Savings Institutions
EBON,Ebang International Holdings Inc. Class A Ordinary Shares,Technology,Semiconductors
EBR,Centrais Electricas Brasileiras S A American Depositary Shares (Each representing one Common Share),Utilities,Electric Utilities: Central
EBS,Emergent Biosolutions Inc. Common Stock,Health Care,Biotechnology: Pharmaceutical Preparations
EBTC,Enterprise Bancorp Inc Common Stock,Finance,Major Banks
EC,Ecopetrol S.A. American Depositary Shares,Energy,Oil & Gas Production
ECAT,BlackRock ESG Capital Allocation Trust Common Shares of Beneficial Interest,Finance,Trusts Except Educational Religious and Charitable
ECBK,ECB Bancorp Inc. Common Stock,Finance,Banks
ECC,Eagle Point Credit Company Inc. Common Stock,Finance,Trusts Except Educational Religious and Charitable
ECC^D,Eagle Point Credit Company Inc. 6.75% Series D Preferred Stock,,
ECCC,Eagle Point Credit Company Inc. 6.50% Series C Term Preferred Stock due 2031,Finance,Trusts Except Educational Religious and Charitable
ECCV,Eagle Point Credit Company Inc. 5.375% Notes due 2029,Finance,Trusts Except Educational Religious and Charitable
ECCW,Eagle Point Credit Company Inc. 6.75% Notes due 2031,Finance,Trusts Except Educational Religious and Charitable
ECCX,Eagle Point Credit Company Inc. 6.6875% Notes due 2028,Finance,Trusts Except Educational Religious and Charitable
ECF,Ellsworth Growth and Income Fund Ltd.,Finance,Finance/Investors Services
ECF^A,Ellsworth Growth and Income Fund Ltd. 5.25% Series A Cumulative Preferred Shares (Liquidation Preference $25.00 per share),,
ECL,Ecolab Inc. Common Stock,Consumer Discretionary,Package Goods/Cosmetics
ECOM,ChannelAdvisor Corporation Common Stock,Technology,Computer Software: Prepackaged Software
ECOR,electroCore Inc. Common Stock,Health Care,Biotechnology: Electromedical & Electrotherapeutic Apparatus
ECPG,Encore Capital Group Inc Common Stock,,
ECVT,Ecovyst Inc. Common Stock,Industrials,Major Chemicals
ED,Consolidated Edison Inc. Common Stock,Utilities,Power Generation
EDAP,EDAP TMS S.A. American Depositary Shares,Health Care,Biotechnology: Electromedical & Electrotherapeutic Apparatus
EDBL,Edible Garden AG Incorporated Common Stock,Industrials,Agricultural Chemicals
EDBLW,Edible Garden AG Incorporated Warrant,Industrials,Agricultural Chemicals
EDD,Morgan Stanley Emerging Markets Domestic Debt Fund Inc. Morgan Stanley Emerging Markets Domestic Debt Fund Inc. Common Stock,Finance,Finance Companies
EDF,Virtus Stone Harbor Emerging Markets Income Fund Common Shares of Beneficial Interest,Finance,Investment Managers
EDI,Virtus Stone Harbor Emerging Markets Total Income Fund Common Shares of Beneficial Interest,Finance,Finance Companies
EDIT,Editas Medicine Inc. Common Stock,Health Care,Biotechnology: Pharmaceutical Preparations
EDN,Empresa Distribuidora Y Comercializadora Norte S.A. (Edenor) Empresa Distribuidora Y Comercializadora Norte S.A. (Edenor) American Depositary Shares,Utilities,Electric Utilities: Central
EDNC,Endurance Acquisition Corp. Class A Ordinary Shares,,
EDNCU,Endurance Acquisition Corp. Unit,,
EDNCW,Endurance Acquisition Corp. Warrant,,
EDR,Endeavor Group Holdings Inc. Class A Common Stock,Consumer Discretionary,Movies/Entertainment
EDRY,EuroDry Ltd. Common Shares,Consumer Discretionary,Marine Transportation
EDSA,Edesa Biotech Inc. Common Shares,Health Care,Medicinal Chemicals and Botanical Products
EDTK,Skillful Craftsman Education Technology Limited Ordinary Share,Real Estate,Other Consumer Services
EDTX,EdtechX Holdings Acquisition Corp. II Class A common stock,Industrials,Consumer Electronics/Appliances
EDTXU,EdtechX Holdings Acquisition Corp. II Unit,Industrials,Consumer Electronics/Appliances
EDTXW,EdtechX Holdings Acquisition Corp. II Warrant,Industrials,Consumer Electronics/Appliances
EDU,New Oriental Education & Technology Group Inc. Sponsored ADR representing 10 Ordinary Share (Cayman Islands),Real Estate,Other Consumer Services
EDUC,Educational Development Corporation Common Stock,Consumer Discretionary,Books
EE,Excelerate Energy Inc. Class A Common Stock,Utilities,Power Generation
EEA,The European Equity Fund Inc. Common Stock,Finance,Trusts Except Educational Religious and Charitable
EEFT,Euronet Worldwide Inc. Common Stock,Technology,EDP Services
EEIQ,EpicQuest Education Group International Limited Common Stock,Real Estate,Other Consumer Services
EEX,Emerald Holding Inc. Common Stock,Consumer Discretionary,Advertising
EFC,Ellington Financial Inc. Common Stock,Real Estate,Real Estate Investment Trusts
